{
  "documents": {
    "label": "Documents",
    "component": "tab",
    "id": "page:form:pb:j_id71_lbl",
    "properties": {
      "documentFolder": {
        "label": "Document Folder",
        "component": "select",
        "type": "string",
        "name": "page:form:pb:j_id72:j_id73:j_id75"
      },
      "hideDocumentName": {
        "label": "Hide Document Name",
        "component": "input",
        "type": "boolean",
        "name": "page:form:pb:j_id72:j_id84"
      },
      "fullPagePreview": {
        "label": "Full Page Preview",
        "component": "input",
        "type": "boolean",
        "name": "page:form:pb:j_id72:j_id88"
      },
      "excludeHiddenLinesInGroupTotals": {
        "label": "Exclude Hidden Lines In Group Totals",
        "component": "input",
        "type": "boolean",
        "name": "page:form:pb:j_id72:j_id90"
      },
      "attachmentTarget": {
        "label": "Attachment Target",
        "component": "select",
        "type": "string",
        "name": "page:form:pb:j_id72:j_id78:j_id80"
      },
      "postToFeed": {
        "label": "Post to Feed?",
        "component": "input",
        "type": "boolean",
        "name": "page:form:pb:j_id72:j_id85:j_id87"
      },
      "enableMultiLanguageTranslations": {
        "label": "Enable Multi-Language Translations",
        "component": "input",
        "type": "boolean",
        "name": "page:form:pb:j_id72:j_id89"
      }
    }
  },
  "groups": {
    "label": "Groups",
    "component": "tab",
    "id": "page:form:pb:j_id105_lbl",
    "properties": {
      "solutionGroupsEnabled": {
        "label": "Solution Groups Enabled",
        "component": "input",
        "type": "boolean",
        "name": "page:form:pb:groupSettings:j_id106"
      },
      "object": {
        "label": "Object",
        "component": "input",
        "type": "string",
        "name": "page:form:pb:groupSettings:j_id109:j_id111"
      },
      "nameField": {
        "label": "Name Field",
        "component": "select",
        "type": "string",
        "name": "page:form:pb:groupSettings:j_id114:j_id116"
      },
      "descriptionField": {
        "label": "Description Field",
        "component": "select",
        "type": "string",
        "name": "page:form:pb:groupSettings:j_id120:j_id122"
      },
      "requireGroupName": {
        "label": "Require Group Name",
        "component": "input",
        "type": "boolean",
        "name": "page:form:pb:groupSettings:j_id108"
      }
    }
  },
  "lineEditor": {
    "label": "Line Editor",
    "component": "tab",
    "id": "page:form:pb:j_id125_lbl",
    "properties": {
      "hideRenewedAssetsWhenEditing": {
        "label": "Hide Renewed Assets When Editing",
        "component": "input",
        "type": "boolean",
        "name": "page:form:pb:j_id126:j_id127:j_id129"
      },
      "visualizeProductHierarchy": {
        "label": "Visualize Product Hierarchy",
        "component": "input",
        "type": "boolean",
        "name": "page:form:pb:j_id126:j_id135"
      },
      "preserveBundleStructure": {
        "label": "Preserve Bundle Structure",
        "component": "input",
        "type": "boolean",
        "name": "page:form:pb:j_id126:j_id137"
      },
      "keepBundleTogether": {
        "label": "Keep Bundle Together",
        "component": "input",
        "type": "boolean",
        "name": "page:form:pb:j_id126:j_id139"
      },
      "totalsField": {
        "label": "Totals Field",
        "component": "select",
        "type": "string",
        "name": "page:form:pb:j_id126:j_id141:j_id143"
      },
      "lineSubtotalsTotalField": {
        "label": "Line Subtotals Total Field",
        "component": "select",
        "type": "string",
        "name": "page:form:pb:j_id126:j_id153:j_id155"
      },
      "largeQuoteThreshold": {
        "label": "Large Quote Threshold",
        "component": "input",
        "type": "number",
        "name": "page:form:pb:j_id126:j_id160"
      },
      "quoteBatchSize": {
        "label": "Quote Batch Size",
        "component": "input",
        "type": "number",
        "name": "page:form:pb:j_id126:j_id162"
      },
      "enableExpandCollapseBundles": {
        "label": "Enable Expand/Collapse Bundles",
        "component": "input",
        "type": "boolean",
        "name": "page:form:pb:j_id126:j_id164"
      },
      "defaultBundleSetting": {
        "label": "Default Bundle Setting",
        "component": "select",
        "type": "string",
        "name": "page:form:pb:j_id126:j_id166:j_id168"
      },
      "actionsColumnPlacement": {
        "label": "Actions Column Placement",
        "component": "select",
        "type": "string",
        "name": "page:form:pb:j_id126:j_id130:j_id132"
      },
      "enableMultiLineDelete": {
        "label": "Enable Multi Line Delete",
        "component": "input",
        "type": "boolean",
        "name": "page:form:pb:j_id126:j_id136"
      },
      "productConfigurationInitializer": {
        "label": "Product Configuration Initializer",
        "component": "input",
        "type": "string",
        "name": "page:form:pb:j_id126:j_id138"
      },
      "enableAssetUpgrades": {
        "label": "Enable Asset Upgrades",
        "component": "input",
        "type": "boolean",
        "name": "page:form:pb:j_id126:j_id140"
      },
      "groupSubtotalsField": {
        "label": "Group Subtotals Field",
        "component": "select",
        "type": "string",
        "name": "page:form:pb:j_id126:j_id147:j_id149"
      },
      "wrapButtons": {
        "label": "Wrap Buttons",
        "component": "input",
        "type": "boolean",
        "name": "page:form:pb:j_id126:j_id159"
      },
      "validateLargeQuotes": {
        "label": "Validate Large Quotes",
        "component": "input",
        "type": "boolean",
        "name": "page:form:pb:j_id126:j_id159"
      },
      "enableCompactMode": {
        "label": "Enable Compact Mode",
        "component": "input",
        "type": "boolean",
        "name": "page:form:pb:j_id126:j_id163"
      },
      "enableLargeQuoteExperience": {
        "label": "Enable Large Quote Experience",
        "component": "input",
        "type": "boolean",
        "name": "page:form:pb:j_id126:j_id165"
      },
      "enableColumnResizing": {
        "label": "Enable Column Resizing",
        "component": "input",
        "type": "boolean",
        "name": "page:form:pb:j_id126:j_id171"
      }
    }
  },
  "plugins": {
    "label": "Plugins",
    "component": "tab",
    "id": "page:form:pb:j_id172_lbl",
    "properties": {
      "legacyPageSecurityPlugin": {
        "label": "Legacy Page Security Plugin",
        "component": "input",
        "type": "string",
        "name": "page:form:pb:j_id173:j_id174"
      },
      "electronicSignaturePlugin": {
        "label": "Electronic Signature Plugin",
        "component": "input",
        "type": "string",
        "name": "page:form:pb:j_id173:j_id175"
      },
      "billingPlugin": {
        "label": "Billing Plugin",
        "component": "input",
        "type": "string",
        "name": "page:form:pb:j_id173:j_id176"
      },
      "productSearchPlugin": {
        "label": "Product Search Plugin",
        "component": "input",
        "type": "string",
        "name": "page:form:pb:j_id173:j_id177"
      },
      "recommendedProductsPlugin": {
        "label": "Recommended Products Plugin",
        "component": "input",
        "type": "string",
        "name": "page:form:pb:j_id173:j_id178"
      },
      "legacyQuoteCalculatorPlugin": {
        "label": "Legacy Quote Calculator Plugin",
        "component": "input",
        "type": "string",
        "name": "page:form:pb:j_id173:j_id178"
      },
      "documentStorePlugin": {
        "label": "Document Store Plugin",
        "component": "input",
        "type": "string",
        "name": "page:form:pb:j_id173:j_id180"
      },
      "quoteCalculatorPlugin": {
        "label": "Quote Calculator Plugin",
        "component": "input",
        "type": "string",
        "name": "page:form:pb:j_id173:j_id181"
      },
      "orderManagementPlugin": {
        "label": "Order Management Plugin",
        "component": "input",
        "type": "string",
        "name": "page:form:pb:j_id173:j_id182"
      },
      "qleCustomActionPlugin": {
        "label": "QLE Custom Action Plugin",
        "component": "input",
        "type": "string",
        "name": "page:form:pb:j_id173:j_id183"
      }
    }
  },
  "pricingAndCalculation": {
    "label": "Pricing and Calculation",
    "component": "tab",
    "id": "page:form:pb:j_id184_lbl",
    "properties": {
      "currencySymbol": {
        "label": "Currency Symbol",
        "component": "input",
        "type": "string",
        "name": "page:form:pb:j_id185:j_id186"
      },
      "unitPriceScale": {
        "label": "Unit Price Scale",
        "component": "input",
        "type": "number",
        "name": "page:form:pb:j_id185:j_id188"
      },
      "enableQuickCalculate": {
        "label": "Enable Quick Calculate",
        "component": "input",
        "type": "boolean",
        "name": "page:form:pb:j_id185:j_id190"
      },
      "allowNonConsecutiveCustomSegments": {
        "label": "Allow Non-Consecutive Custom Segments",
        "component": "input",
        "type": "boolean",
        "name": "page:form:pb:j_id185:j_id192"
      },
      "enablePricingGuidance": {
        "label": "Enable Pricing Guidance",
        "component": "input",
        "type": "boolean",
        "name": "page:form:pb:j_id185:j_id194"
      },
      "quoteLineEditsForUsageBasedPricing": {
        "label": "Quote Line Edits for Usage Based Pricing",
        "component": "input",
        "type": "boolean",
        "name": "page:form:pb:j_id185:j_id196"
      },
      "useLegacyCalculator": {
        "label": "Use Legacy Calculator",
        "component": "input",
        "type": "boolean",